rank ,id,problem,solution,Categories,relevance_problem,clarity_problem,suitability_solution,clarity_solution,Overall score ,See Details
1,844,"Single-use plastic packaging is one of the largest challenges of the century. It not only fills up landfills due to its non-biodegradable nature but also harms wildlife when it enters water bodies. It generates tons of CO2 in manufacturing and causes air pollution when incinerated. Lastly, this bulky but lightweight waste incurs high transport costs for its disposal.","My solution is to replace single-use plastic packaging with mycelium-based packaging. Mycelium, the root structure of mushrooms, can be grown using agricultural waste like straw or corn stalks. It forms a solid and shock-resistant material, perfect for replacing styrofoam and other plastic-based packaging.   The process of growing mycelium packaging can even occur on-site within businesses, significantly reducing transportation emissions associated with plastic packaging. Once used, the mycelium packaging can be composted or broken down naturally, returning to the earth without leaving any harmful residues.   This closed-loop approach does not merely reduce environmental impact but also generates value for businesses. Cost savings can be gained from the cheap and locally available raw materials (agricultural waste). On-site production eliminates the need for transporting bulky packaging materials. The end product - a compostable packaging material - could also appeal to eco-conscious consumers, improving brand image and customer loyalty.   Though the implementation of this solution requires an initial investment in set-up and some learning on growing mycelium, it is highly feasible due to its low complexity. It is also scalable as the process just requires agricultural waste, which is abundantly available across different geographical locations. This solution thus presents a revolutionary step in the transition towards a truly circular economy in packaging.",1,3,2,3,2,3,
2,737,"Single-Use Plastic Waste â Single-use plastic items clog up our landfills and pollute our oceans. They pose a direct threat to marine life and contribute significantly to our carbon footprint. Also, they are not always-recycled, creating an environmental crisis as they take hundreds of years to decompose.  ","Implement Up-Cycling Plastic Programs - Rather than just recycling, businesses could implement an """"up-cycling"""" approach, where consumers return used plastic goods or packaging. These returned items then get processed and reused in the creation of new, higher-quality products. This creates a circular economy, which has significant environmental benefits by drastically reducing plastic waste. It also reduces the costs associated with sourcing new raw materials and could be financially beneficial to businesses. This system could be further upscale by tying the return of recycled items to a rewards system, incentivizing regular participation.",1,2,2,1,2,1,
3,916,"The problem I am addressing is the massive amount of e-waste that is generated annually. Electronic waste, also known as e-waste, includes discarded electronic devices and components as well as substances involved in their manufacture or use. Consumption patterns and the rapid rate of obsolescence contribute to a growing problem which not only leads to environmental pollution but also represents a loss of valuable materials. Not only is this a major environmental problem, but it also contributes to social issues, as much of this e-waste is exported to developing countries for informal processing, often involving hazardous conditions.   In terms of business costs, many companies introduce new versions of electronic devices at a high frequency, resulting in retired products that still have much potential for use. Such practices add to the hazards of electronic waste, and also put pressure on companies to bear both the cost of rapid product launches and the expense of recycling or disposing old products.   ","My solution is to promote a """"Device as a Service"""" (DaaS) business model. In this model, companies would lease devices to consumers, rather than selling them the physical product. When an upgrade is available, the customer would simply return the old device to the company, and in turn the company would lease them the new device. The returned device could then be refurbished and leased to another customer, or properly recycled if it's no longer usable.   Through this model, companies can assure that the disposal or recycling of these devices is done responsibly, without hazardous impacts. Moreover, businesses can save costs by reclaiming and reusing valuable materials from obsolete products. This model also has a positive environmental impact as it reduces the need for raw materials and energy for production and curtails e-waste. Furthermore, it still satisfies consumer desire for the latest technology, upsetting the notion that sustainability means going without. This is a win for the environment, customers and businesses alike and has the potential to bring about disruptive change in electronic device industries. This idea needs support and collaboration with policy makers for implementation and hence the success and scalability are dependent on various external factors. However, with growing awareness and push for sustainable solutions, there is a clear market for such models.",3,2,2,,2,,
4,468,"The vast amount of waste continuously produced is ending up in landfills or incinerated, both adding to harmful environmental impacts. Furthermore, this waste represents lost economic value, as many materials can be reused or repurposed.  ","The enhanced solution presents an integrated, digital platform linked with """"Waste to Resource Hubs"""". This digital tool, similar to an """"Uber for waste"""", would allow businesses and individuals to list their waste products. Then, other businesses or individuals, who need those materials for upcycling, repurposing, or recycling, can claim and purchase through the platform.  Enabling direct exchanges through the platform minimizes unnecessary transport and speeds up the reuse process. It motivates businesses and individuals to list their waste, as they can directly turn their waste into income. The platform also empowers small-scale manufacturers and DIY makers who seek specific materials, allowing a more circular and sustainable consumption.  Furthermore, the platform would include a carbon tracking and calculation functionality. By tracing the lifecycle of materials, it could provide data on carbon emissions saved by its users, enhancing the environmental benefits and enabling the creation of a potential carbon credit market.   The solution increases the scalability and accessibility since it doesn't strictly depend on the hubs' physical presence or size. Similarly, it offers greater financial and environmental benefits by enabling a direct market for waste, reducing total transport, and enhancing waste reclamation speed while providing clear carbon-saving metrics.",0,3,2,,2,,
5,443,"The fashion industry is infamous for its massive waste production, from unsaleable stock to textile offcuts from pre-purchase manufacturing stages. This presents a glaring environmental issue, but also a missed business opportunity with respect to under-utilized assets.  ","Enter """"StyleStock"""", a B2B digital platform that creates a circular economy within the fashion industry by not only handling unsold stock and textile waste but also incentivizing the fashion retails with direct financial benefits.  The primary component of StyleStock is its comprehensive marketplace where companies can sell or trade their unsaleable stock or residual fabrics that would have otherwise gone to waste. However, in order to enhance financial impact, StyleStock differentiates itself by incorporating a unique 'credit system'. Every time a company lists an item on the platform, they are awarded StyleStock credits as an extra bonus, which can be used to purchase other materials or items listed on the platform. Moreover, these credits can also be converted into carbon credits, thereby enabling fashion retailers to fulfill their corporate sustainability obligations and tap into the carbon trading market.  To further elevate financial incentives, StyleStock will collaborate with manufacturing firms that specialize in creating upcycled textiles from waste materials. Businesses can sell their unneeded stock or unused fabrics to such manufacturers, thus monetizing waste and indirectly contributing to more sustainable fabrics.  Finally, StyleStock will also provide AI-Driven predictive analysis data about potential demand and pricing for various types of textiles and garments based on industry trends, helping businesses make informed decisions about production, therefore minimizing waste and increasing profitability.  This integrative approach not only embodies the spirit of the circular economy but also directly benefits businesses financially and promotes more strategic production planning, making it an appealing solution for both the planet and the pocket.",2,2,3,,3,,
6,1012,Not having internet or lights at home,"The idea is to create lightbulbs with battery, so you can still have lights when you dont have energy. also, the lightbulb will be used to share internet from a mobile device",0,2,2,,2,,
7,1035,"The ever-increasing problem of plastic waste is not only a threat to wildlife and ocean health, but also significantly contributes to global carbon emissions. Existing recycling programs often rely on energy-intensive processes, and many types of plastic cannot be recycled conventionally.  ","A sustainable solution would be to transform plastic waste into durable construction materials, specifically into plastic bricks. This process uses an innovative low-energy technology, utilizing a compression process to form bricks with various types of clean, uncycled plastic. The plastic bricks are cheaper, lighter, more durable, and offer better insulation than traditional bricks, creating a cost-effective option for construction companies. Additionally, this solution affords a secondary benefit of paving the way for road construction, especially beneficial in developing countries. This not only creates an additional revenue stream in the form of cost-competitive building materials but also helps in reducing our environmental footprint by repurposing plastic waste.",1,3,2,,2,,
8,383,"The global fashion industry is one of the world's major polluting industries, with a significant carbon footprint and waste generated through production and disposal of garments.   ","We propose an innovative circular business model called """"Fashion-as-a-Service"""". This venture would work by leasing garments to customers, thereby encouraging the reuse and constant recycling of clothes. It is also designed to adapt to rapidly changing fashion trends without excessively producing and wasting clothes.  In this model, customers will pay a subscription fee to have access to a constantly updated wardrobe. The returned clothes could be cleaned, repaired if necessary, and then leased out again. Damaged clothes that can't be repaired would be recycled into new clothes, reducing waste. This idea could be economically beneficial as businesses can profit from recurring subscription fees rather than one-time sales. Moreover, it encourages companies to create more durable clothing as these would see increased usage.   The environmental impact could be massive. By recycling and reusing garments, we drastically cut down on the waste amassed by the fashion industry and decrease our reliance on the production of new clothes.   This model's feasibility and scalability can be observed in existing sectors: """"Car-as-a-service"""" is becoming a trend, and this same concept can be applied to the fashion industry. Businesses could start small-scale, targeting environmentally conscious consumers or specific niches such as high-end fashion or staple basics.  Overall, this could potentially revolutionize the fashion industry, making it more sustainable, profitable, and in line with the circular economy principles.",2,2,3,,3,,
9,244,"E-waste, one of the most rapidly growing environmental issues, due to improper disposal and underutilization of electronic goods.  ","An evolved """"Digital Recycle & Renew Hub"""" that facilitates the donation, sale, repair, and proper recycle of electronic goods. This hub, going a step further, would incorporate IoT (Internet of Things) technology to track the lifecycle of the electronic goods â from first use to final recycle.   The platform would have separate portals for donors/sellers, repair services, buyers, and certified recyclers. Donors/sellers would list their items, which could be bought directly or flagged for repair then resale. Buyers make a recycle pledge and IoT-enabled tracking assures the fulfillment of their commitment. In cases where the item cannot be repaired, it's forwarded to a certified recycler.  This solution's novelty lies in its end-to-end tracking of electronic product lifecycles and integrating the repair function into its operations. The environmental impact is more far-reaching, as it targets the e-waste problem, promotes recycling, and encourages the repair and reuse of electronic goods. Financially, businesses could reduce their electronic purchase costs, earn from the resale of their own electronic waste, and boost their reputation for sustainability.   The incorporation of IoT adds to initial setup costs but enhances the feasibility of the model by providing effective tracking to ensure recycling commitments. Such a platform has great potential for scalability in the expanding digital marketplace, providing a holistic solution for e-waste while driving the circular economy.",3,2,2,,2,,
10,234,"Widespread usage of single-use plastic water bottles have become a significant environmental concern globally. They contribute to significant landfill waste and ocean pollution, often not decomposing for hundreds of years.   ","One effective solution could be to incentivize the use of refillable containers and launch Pure Fill Stations in high-footfall areas such as universities, schools, shopping centers, and corporate offices. These stations would provide pure filtered water at a fraction of the cost of typical bottled water, allowing consumers to refill their reusable bottles. Various payment options can be offered at these stations for convenience. Partnerships with local governments, sustainability grants, or corporate sponsorships can help implement these stations cost-effectively. This solution not only reduces plastic landfill contributions but also promotes responsible consumer behavior, potentially saving businesses millions in costs associated with waste management.",1,3,2,,2,,
11,924,"The world is currently facing an enormous environmental crisis due to the rampant use of plastic products. These products are not only harmful to the environment but also pose a serious threat to human health. One major contributor to this problem is the food delivery industry, which heavily relies on plastic containers and plates for food deliveries. The industry generates an enormous amount of plastic waste daily, which often ends up in landfills, oceans, and other natural habitats, leading to devastating consequences for wildlife and ecosystems.","Use of eco-friendly cardboard boxes for food deliveries, which can also double as plates for consuming food. This innovation will drastically reduce plastic waste and mitigate the harmful impact of plastic on the environment and human health. These eco-friendly cardboard boxes are not only biodegradable but also compostable, making them an ideal alternative to plastic containers.

Furthermore, these eco-friendly cardboard boxes are cost-effective and easy to produce. They are lightweight, easy to transport, and can be easily recycled or repurposed. With the increasing demand for sustainable solutions, the adoption of these eco-friendly cardboard boxes in the food delivery industry will not only benefit the environment but also improve brand image and customer loyalty.",1,2,3,,3,,
12,463,"The """"Green Packaging Partnership"""" solution is meant to address the problem of excessive waste generated by the packaging industry. The packaging industry is a significant contributor to global waste, with a significant amount of the waste ending up in landfills or as litter in the environment. This has negative impacts on the environment, including air and water pollution, habitat destruction, and climate change.

In addition, many packaging materials are made from non-renewable resources, which contributes to resource depletion and environmental degradation. Furthermore, many packaging materials are not recyclable, and even those that are recyclable may not be recycled due to lack of infrastructure or contamination.

The """"Green Packaging Partnership"""" solution aims to address these issues by promoting the use of sustainable packaging materials and improving the recyclability of packaging materials. By doing so, the solution can help reduce waste, conserve resources, and promote a more sustainable packaging industry.","The """"Green Packaging Partnership"""" is a program that brings together businesses and consumers to reduce waste from packaging. The program encourages businesses to use environmentally friendly packaging materials and provides incentives for consumers to return used packaging for recycling or reuse.

The program would work by establishing partnerships between businesses and recycling facilities to ensure that all packaging materials are properly collected, sorted, and recycled. Businesses that participate in the program would receive a """"green packaging"""" certification, which would help promote their commitment to sustainability and attract environmentally conscious consumers.

To incentivize consumers to return used packaging for recycling or reuse, the program could offer discounts or rewards for each returned item. These rewards could be in the form of discounts on future purchases, loyalty points, or other benefits.

To make this initiative impactful, the program could focus on industries with high levels of packaging waste, such as the food and beverage industry. By promoting the use of environmentally friendly packaging materials and encouraging their reuse or recycling, this initiative would significantly reduce the environmental impact of these industries.

To make the initiative feasible, the program could initially focus on a specific region or industry sector, gradually expanding as it gains traction. The program could generate revenue by charging a small fee for businesses to participate or by partnering with retailers to offer discounts on future purchases.

To make the initiative scalable, the program could partner with other circular economy initiatives, such as waste management programs or product-as-a-service providers. This would help create a more integrated circular economy system and maximize the impact of the program.

Overall, the """"Green Packaging Partnership"""" has the potential to be a creative, impactful, feasible, and scalable initiative that could significantly reduce waste from packaging and promote the circular economy in the business sector.",1,2,2,,2,,
13,576,"The current practices in the apparel and construction industries contribute significantly to environmental issues due to their resourcesâ consumption patterns. For instance, the apparel industry extensively uses new materials for production without recycling or reusing old fabric, while the construction proportionally utilises tons of brittle, non-flexible, expensive materials.  ","To mitigate these environmental concerns, we propose two strategies. First, we suggest implementing upcycling initiatives in the apparel industry that turn waste or reusable materials into high-quality clothes, thereby reducing waste, cutting down costs, and creating a sustainable clothing lifecycle. Simultaneously, within the construction industry, we should focus on substituting heavy, costly traditional construction materials with a flexible, affordable, and environmentally friendly alternative. By doing so, we ensure that the resulting structures are more adaptable to natural disasters resulting in less damage and rebuilding costs over time.",0,3,2,,2,,
14,232,"The customary model of production and consumption, often called the """"take-make-waste"""" model, is creating an unsustainable demand on our planet's resources. Also, it generates an alarming amount of waste that is continuously degrading our environment.  ","My proposition for a circular economy idea is """"Tech Device Leasing and Refurbishing"""". With how fast technology is progressing, businesses and consumers often replace their electronic devices, such as computers, smartphones, and tablets, every few years. This rapid cycle of consumption and disposal grows the sizable pile of electronic waste, threatening our environment; plus, it demands an unsustainable extraction of rare earth minerals.  In the Tech Device Leasing and Refurbishing model, manufacturers lease devices to businesses and consumers instead of selling them. When the lease ends, the devices are returned to the manufacturer. Once these devices are back, they can be refurbished, updated with new software or hardware, and then leased out again. If the devices are too old to be updated, manufacturers can disassemble them to reclaim and reuse valuable components, drastically reducing the need for new resource extraction.  This model holds significant benefits for businesses because it can provide constant access to up-to-date technology at a lower cost. It could also reduce the tech industry's environmental footprint and transform it from a linear to circular model. It is viable given the increasing focus on reducing e-waste and a drive towards sustainable business practices. The scalability potential of this idea is high considering the increasing consumption of tech devices globally.",0,2,3,,3,,
15,59,"Today, millions of tons of textile waste end up in landfill, leading to severe environmental damage. The fashion industry is one of the most polluting industries in the world and is primarily linear, meaning it produces a significant amount of waste that is not effectively reused or recycled.  ","A 'Clothes-as-a-Service' model could transform the fashion industry. Under this model, brands maintain ownership of the clothes and lease them to customers for a period. This service allows customers to get the style and variety they want, discouraging the tendency for impulse purchases that end up in the landfill. Once clothes are returned, they are cleaned, repaired, and leased again. When they are no longer rentable, these clothes can be recycled in a way that keeps the raw materials in the cycle. This model also offers an opportunity for companies to invest in more durable, high-quality garments, which are more environmental-friendly.",2,2,2,,2,,
16,742,"The idea is based on reusing nuclear waste as an energy extraction element. This based on renewable energy from biomass. In this case, based on nuclear waste.",Disposal of radioactive waste from nuclear power plants. Using it as an energy source to the same extent as biomass renewable energy.,0,3,2,,2,,
17,1002,"The primary problem targeted is the inefficient and wasteful global food system. This problem is multi-faceted, with overproduction and wastage of food on one side, and malnutrition and scarcity on the other. Tracking and accountability of surplus food for redistribution also pose significant challenges.  ","My proposed solution utilizes a more targeted form of AI, known as Machine Learning (ML), coupled with Blockchain technology. The ML model can analyze and predict supply and demand trends based on various factors like historical food sales, crop yields, weather patterns, and consumer trends, thereby initiating the food production and distribution processes accordingly. The redundancy of food production will decrease and thus, wastage. Additionally, decoupling the food supply chain using blockchain technology ensures transparency and enables direct transactions between producers and consumers. This digital """"food ledger"""" will optimize redistribution, explicitly pinpointing where surplus food exists, then rerouting it to areas of need. Simultaneously, smart contracts facilitated by blockchain will handle transactions, ensuring smooth and secure operations. By combining ML and Blockchain, this solution will provide an innovative circular approach to the food system that will reduce waste, optimise resources, and efficiently manage global food distribution.",4,2,2,,2,,
