rank ,id,problem,solution,Categories,relevance_problem,clarity_problem,suitability_solution,clarity_solution,Overall score ,See Details
37,1183,"Transition to eco-friendly electric vehicles (EVs) in developing countries is lagging due to the scarcity of public charging facilities and the high cost of establishing them. This makes potential EV owners hesitant to transition from fossil fuel vehicles, hindering sustainable development efforts to mitigate climate change.  ","""""Charger Anywhere and Everywhere"""" is a simple, economical, and innovative solution for the EV industry. This program introduces a portable digital device, attachable to any EV charger, that monitors electricity consumption (in units) during charging. The device synchronizes with a smartphone application, enabling it to calculate real-time power usage.   When an EV owner charges their vehicle at any place, whether it be a shop, office, cafe, or home, the digital device will inform the application about the amount of electricity consumed. The application then calculates the cost of the electricity at the current rate. Payment is made through the application, providing an energy trade-off system that both the electricity provider and the EV owner find fair and profitable.   The benefits include:   1. EV owners now feel free to travel long distances without worrying about finding a charging station. 2. Residents without EVs can participate in the green economy by providing electricity for recharging. 3. The financial burden of establishing large-scale charging infrastructure is minimized. 4. It fosters a local marketplace for energy, promoting economic activity. 5. The increase in EV usage reduces fossil fuel consumption and carbon emissions, thus benefiting the environment.  This grassroots solution swiftly and efficiently expands EV charging networks in developing nations, promoting a high-impact transition to a more circular, green economy.",0,2,2,,2,,
38,129,"Eliminate the need for thousands of plastic bottles, cans, glass bottles or any other recipient used for beverages.","Instead of producing beverages in bottles, cans or other recipients which are small and in large numbers, the beverage can be stored in a bigger container which works like a """"vending machine"""". The customer pays for 1 litre of liquid and brings his own bottle and the machine provides the liquid. In this way the manufacturers don't need to store the beverages in thousands of bottles. The pollution will be reduced due the lack of need for the same number of recipients. The container is refillable, so no need for thousands of bottles or cans or any other recipients.",0,3,2,,2,,
39,352,"The fast fashion industry contributes to environmental pollution and waste, with its focus on rapid production cycles and disposable clothing. This arises from wasteful production methods, harmful use of chemicals, and labor exploitation.   ","Introducing a distributed blockchain system within the Circular Fashion model would efficiently encourages traceability, ownership, and incentivization.   The blockchain platform could, for example, use digital tokens to reward consumers for participating in sustainable activities. These tokens could be redeemed for discounts on future purchases or repair services. By making sustainable behavior rewarding, it is more likely to encourage the large-scale consumer shifts necessary for the success of the Circular Fashion model.   Meanwhile, the transparent nature of blockchain technology could assist in traceability: ensuring the ethical creation of products and their lifespan, from raw materials through to end consumers. This allows customers to make more informed decisions about their purchases, and can enhance brand reputation.  The improved Circular Fashion model with blockchain technology would not only maintain the environmental benefits of the initial model, but it could be more financially viable, rewarding both consumers and businesses. It could also inspire profound innovation in consumer-business relationships and go beyond the fashion industry to other industries facing similar issues.",2,2,2,,2,,
40,504,"The escalating electronic waste problem is detrimental to our planet. With rapid tech advancements and decreasing lifecycles for electronic products, e-waste is a persistent and exponentially growing global concern.  ","I propose the creation of a Closed-Loop System for Electronic Devices. This holistic concept significantly enhances environmental impact by reducing electronic waste, conserving natural resources and minimizing hazardous waste disposal.  This process starts with designing products for longevity, repair, and recycling. Manufacturers should prioritize modularity and durability during the design phase which could enhance product life and simplify the repair process.   The next point of intervention is during the use phase. Companies should encourage consumers to repair and upgrade devices rather than replacing them. This can be achieved by making spare parts and repair manuals easily accessible, and promoting software updates that don't slow down older models.   Once the device has reached the end of its life, the materials are recycled and fed back into the production process. Manufacturers would need to develop and use advanced technology for efficient recycling of electronic components and a robust tracking mechanism to ensure no component goes to waste.  Moreover, an incentivised return system could be established. Consumers could return their old devices, for which they would receive discounts on new purchases or other rewards. These returned devices could then be refurbished and sold, or recycled in an environmentally friendly way.  Such a system reduces reliance on the extraction of new materials, consequentially reducing the environmental impact. This also saves costs in the long run and could open up new market opportunities for refurbished or reused devices.   However, the success and scalability of this solution largely depend on manufacturers willingness to shift their priorities from selling more to creating circular, sustainable value, and regulatory support. Government regulations should encourage such practices and consumers should be made aware of the importance of the issue and the potential their actions hold.",3,2,2,,2,,
41,193,The problem of plastic waste.,The solution is to use plastic to create bricks for construction and to pave roads,1,3,2,,2,,
42,804,"Lipids oxidation in food is the major causes of food spoilage, and since lipids play an important roles in good quality and nutrition in food, however, it is one of the main and easy target of oxidation reaction causes by reactive oxygen species(free radicals), which leads to spoilage of the food, reduced it's quality, off-odurs and flavors, colour changes, and nutrition value reduce.","Since lipids oxidation which leads to the food spoilage is caused by oxidation reaction by reactive oxygen species(free radicals), then increasing of the antioxidants of the food content which would scavenge the reactive of species and inhibit most of their reactions should be one of the major solution. Also, genetic modification of some species of plant and veggies, to inhibit the activities of reactive oxygen species (free radicals).",4,2,3,,3,,