rank ,id,problem,solution,Categories,relevance_problem,clarity_problem,suitability_solution,clarity_solution,Overall score ,See Details
18,1187,"The fashion industry contributes significantly to environmental degradation due to excessive waste production and resource consumption, with many items ending up in landfills or being incinerated. The industry also lacks efficient and green recycling initiatives, with standard recycling methods consuming immense amounts of water and toxins.  ","The creation of """"GreenWear Partnerships"""" â a collaborative global network of fashion firms, recycling companies, and non-profit organizations working towards sustainable fashion. The framework of GreenWear includes the implementation of rental, repair, and franken-design (blending fragments of multiple old garments to create new) systems alongside recycling initiatives like RecycloFabric. It integrates environmental consciousness not only in recycling but throughout the product's lifecycle.   GreenWear partners contribute by offering clothing rentals, facilitating garment repairs or by donating unfit material to franken-designers, reducing the need for purchasing new clothes. And when the cloth's lifecycle ends, the RecycloFabric technology can be implemented for recycling. This comprehensive solution promotes the use of shared resources, minimizes new production, and innovatively utilizes existing waste materials, highly benefitting the environment.  Financially, GreenWear could help businesses diversify their earning models with rental or repair services, or by selling franken-design creations. Moreover, the implementation costs of GreenWear's circular model can be substantially reduced by shared network resources and collaborative initiatives within the partnership.  In terms of feasibility and scalability, the partnership-based system fosters mutual support and network growth, increasing the potential for scalability and successful adoption industry-wide. Partnerships can begin locally and grow progressively into a global impact network. This solution provides a holistic, collaborative approach to a circular economy in the fashion industry.",2,2,2,,2,,
19,1293,Primarily textile and plastic waste management and possibly (by a long shot) increase in the  cultivation of food plants,"The idea is of replacing cotton ( sourced from farms ) used in mattresses, cushions, sofas and chairs etc. with - appropriately processed - thrown/garbaged textiles (and/or other possibly other waste such as certain type of plastic, rubber or other king of waste). I think it will benefit in  two ways. First by directly providing us a way of recycling the aforementioned waste. And secondly (not a definite but a plausible expectation), the land area under cultivation for cotton going to cushioning purposes can or might get utilized for other in demand or needed purposes.",4,3,3,,3,,
20,1051,Recycle bottle to sell home made tuak,"Tuak is a homemade rice fermented drink that iban woman made to celebrate good harvest. Tuak are normally drink in longhouse for social events. And woman collect bottles, from good quality glass bottle to plastic bottles to store. ",0,2,2,,2,,
21,1004,"Based on my initial answer, the problem that this solution is meant to solve is the overuse of non-renewable resources and the resulting environmental degradation, waste, and pollution. By implementing circular economy practices, businesses can reduce their reliance on finite resources, minimize waste and pollution, and create a more sustainable and resilient economy that benefits both the planet and businesses.

The waste exchange platform solution is meant to address the problem of waste generation and disposal, which is a major environmental issue facing many industries today. Many businesses generate waste materials or by-products in their production processes, which are typically disposed of in landfills, incinerators, or through other waste management practices.

This traditional waste management approach often results in negative environmental impacts, including greenhouse gas emissions, soil and water contamination, and resource depletion. It is also costly for businesses, as they often have to pay for waste disposal and may face regulatory fines for improper waste management.

The waste exchange platform solution aims to create a circular economy by facilitating the exchange of waste materials or by-products among businesses. By finding ways to reuse or recycle these waste materials, the solution can reduce waste generation, lower costs for businesses, and minimize environmental impacts. It can also create new revenue streams for businesses and promote sustainable practices in industries that traditionally generate a lot of waste.","The solution is to implement circular economy practices within businesses. This involves moving away from the traditional linear """"take-make-dispose"""" economic model and towards a circular model, where waste is minimized and resources are kept in use for as long as possible. This can be achieved by implementing practices such as designing products for durability and repair, using renewable energy sources, recycling and repurposing materials, and reducing waste throughout the supply chain. By adopting circular economy practices, businesses can create financial value while also benefiting the environment by reducing waste and pollution, and preserving natural resources for future generations.

One real-life use case for companies to implement circular economy principles in their businesses is to implement a product-as-a-service model. This model involves offering products to customers as a service instead of as a one-time purchase. For example, a company could offer a laundry service for clothing instead of selling the clothes outright to the customer.

This solution has several benefits that make it stand out from existing solutions. First, it reduces waste by encouraging customers to use products for longer periods of time. Second, it incentivizes companies to design products that are more durable and repairable, as they will be responsible for maintaining and repairing the products throughout their lifetimes.

From an environmental standpoint, this solution has the potential to greatly benefit the planet by reducing the amount of waste generated from single-use products. Additionally, the focus on product durability and repairability can lead to a reduction in the use of natural resources in the production of new products.

From a financial perspective, implementing a product-as-a-service model can lead to increased revenue streams for companies. Instead of relying solely on one-time purchases, companies can generate recurring revenue through ongoing service contracts. Additionally, companies can potentially reduce costs associated with the production and disposal of products.

Feasibility and scalability of implementation depend on the specific product or service being offered, but many industries already have successful examples of product-as-a-service models. For example, some car manufacturers offer car-sharing programs where customers can rent cars on a subscription basis. Overall, this solution has the potential to be highly scalable and feasible for many businesses, especially those with products that have a longer lifespan.",0,2,2,,2,,
22,359,"The furniture industry contributes to deforestation and pollution, with discarded wood furniture being burnt or sent to landfills, leading to substantial environmental damage.  ","Implement a 'Furniture Rebirth' program. When a consumer decides to change their furniture, the old item could be returned to the manufacturer. The manufacturer then integrates recyclable parts (wood or plastic) into the production of new pieces or refurbishes the items for resale. This solution ensures:  1. Reduction of environmental pollution due to minimized burning of old furniture and decreased deforestation. 2. Financial impact is positive as manufacturers decrease raw material costs and can sell refurbished units at a competitive price, possibly opening a new market segment, and consumers get incentivized with discounts on their next purchase. 3. It's feasible, as it only needs adjustments in the existing supply chain and scalability depends on consumer awareness and participation.",0,2,3,,3,,
23,954,The problem this solution is meant to solve is reducing waste in commercial kitchens and other industries by monitoring and analyzing waste.,"The solution is a smart waste management system developed by British start-up Winnow. The system uses smart meters to analyze the waste produced in commercial kitchens, measure the amount of food waste and identify ways to reduce it. This technology can be applied in other industries to monitor and reduce waste.",0,2,2,,2,,
24,480,"The absence of a comprehensive global system to identify and track waste byproducts from manufacturing processes limits efficient reuse and recycling efforts, thereby hindering progress towards a circular economy.  ","Implement a global waste tracking and categorization system to increase transparency and efficiency for recycling efforts.   This system, a """"Product Waste Passport,"""" will start at the manufacturing level where raw material inputs are recorded, specific waste outputs predicted, and potential waste categories assigned. Each manufactured product will carry a digital passport indicating the type of waste it will generate at the end of its life and guidance on suitable recycling or reprocessing methods.  The system will require collaboration between manufacturers, recycling firms, and a governing body responsible for oversight and enforcement. Manufacturer responsibility will extend to supplying accurate data for the system; recyclers will ensure effective waste collection and submission of these details into the system, and the governing body will ensure data integrity and provide policy support.  This scalable solution can drive waste collection and recycling efficiency, increase recyclable material value, reduce environmental harm, and bring us closer to realizing a truly circular economy.",0,3,2,,2,,
25,50,"Many students struggle with affording textbooks each semester due to high costs, contributing to financial stress during their academic studies.  ","Implement a textbook rental system within universities so students can lease instead of buying them. This not only makes education more affordable but also promotes reusable resources, driving the educational sector towards a circular economy. The used textbooks can be repaired or refurbished if necessary, ensuring their maximum use. The system could also incorporate a platform for students to share or exchange books, facilitating further reuse.",0,2,2,,2,,
26,845,"Plastic-based food packaging is a major contributor to the environmental issue of non-biodegradable waste accumulation. This problem is global, with millions of tons of single-use plastic packaging dumped in the environment each year. Industries contribute significantly to this problem by using non-sustainable packing techniques, creating pollution and adding to landfill waste.  ","Using food packaging derived from bamboo fibers can significantly help mitigate this issue. Bamboo, a fast-growing plant, is a renewable resource with the potential to replace countless single-use plastic products. It's an innovative approach given its lesser usage in the food packaging industry presently. Bamboo packaging contributes less waste as it is biodegradable and also creates a positive environmental impact. For businesses, it provides the dual benefits of reduced waste management costs and a better corporate image aligning with sustainable practices. In terms of feasibility, transitioning from plastic to bamboo packing, though challenges like new supply chains exist, can be smoothly realized with a phased approach. Bamboo's fast-growing nature also means this solution has excellent scalability potential, proving to be a sustainable long-term choice.",1,2,2,,2,,
27,414,"Public traffic regulatory authorities lack any control of autonomous vehicle flow, totally dependent on vehicle suppliers' self-control","Similar to green-amber-red traffic lights, this provides traffic regulatory authorities a non-invasive solution for better control of autonomous vehicle flow",0,3,2,,2,,
28,298,The rapidly increasing amount of electronic waste poses both environmental pollution and health risk. E-waste contains valuable material that could be repurposed but is usually wasted due to improper disposal.,"To solve this issue, we propose 'TechLottery.com', an online platform where consumers can exchange their old electronics for an entry into a raffle with a chance to win exciting prizes. This system incentivizes responsible e-waste disposal by turning it into an opportunity to win desirable items, encouraging recycling at the consumer level.   TechLottery would create partnerships with technology companies, like Apple or Samsung, who could provide the prizes and benefit from the recyclable materials. Partnering with reputable figures in the tech industry for promotion will increase engagement and trust in the platform.  For efficient operations, participating companies could employ their existing delivery services to retrieve e-waste when delivering a new product. The drawing date of the raffles could be tied to recycling milestones to encourage participation.  'E-cycling' deals and promotions could also be featured on TechLottery. The website would serve as a comprehensive platform to motivate better electronics recycling, ultimately steering consumer behavior towards a circular economy. This concept tackles the electronic waste problem at its sources - consumer disposal habits.",3,2,2,,2,,
29,87,"The fast fashion industry is built on the premise of producing clothes quickly and cheaply, resulting in a throwaway culture where clothes are only worn a few times before being discarded. According to the Ellen MacArthur Foundation, the fashion industry produces 92 million tons of textile waste each year, contributing to 4% of the world's total waste. In addition, the production of new textiles uses significant amounts of energy and water, resulting in greenhouse gas emissions.","Creating a closed-loop textile system can help reduce textile waste and emissions. This system involves creating a circular economy where textiles are reused and recycled. Here are some ideas to achieve a closed-loop textile system:

Rental or second-hand clothing services:
Creating rental or second-hand clothing services can help reduce the demand for new clothes and promote the use of existing clothing. This can be done through subscription services or physical stores that offer rented or second-hand clothes.

Use of recycled fabrics:
Using recycled fabrics in new products can help reduce the demand for new textiles and promote the use of existing fabrics. This can be done through collaborations with recycling companies or by creating products made from recycled fabrics.

Development of biodegradable textiles:
Developing biodegradable textiles can help reduce the amount of textile waste that goes to landfill. This can be done through the use of natural materials such as bamboo or hemp, or through the development of biodegradable synthetic materials.",2,2,2,,2,,
30,124,"The massive environmental footprint of the fashion industry, fuelled by the fast fashion trend, incorporates not only post-consumer waste but also pre-consumer waste - primarily fabric offcuts and overproduction, that end up in landfill or incinerated.  ","A B2B sharing platform for pre-consumption waste in the textile industry. This platform would connect fashion brands and manufacturers, serving as a marketplace for surplus fabric and offcuts. Businesses could sell their excess materials or exchange them for other needed materials. Small and upcoming designers would get to purchase high-quality fabrics at lower prices. An initiative like this could be more readily embraced by the industry, as it targets waste reduction at the source and simultaneously cuts down the costs related to waste management and new material purchase, therefore having a dual positive financial impact for the companies involved.   Moreover, this solution is highly scalable as it can cater to businesses of all sizes across various geographical locations. It promotes a shift from the """"take-make-dispose"""" trend towards """"reduce-reuse-recycle"""" at a systemic level, thus potentially making a significant difference in the environmental impact and sustainability of the textile industry.",2,3,2,,2,,
31,1204,"The current problem lies within the textile dyeing industry, which is heavily reliant on water and chemical usage. This traditional method results in substantial environmental damage, including water contamination due to harmful chemicals, exhaustion of non-renewable resources, and energy-intensive processes leading to high greenhouse gas emissions.  ","Implementing the innovative technique of microbial textile dyeing has the potential to revolutionize the industry. Utilizing genetically modified bacteria to produce eco-friendly textile dyes, this process is devoid of hazardous chemicals traditionally employed, significantly reducing water pollution and health risks for workers. Using less water and energy than the traditional dyeing methods, it decreases the industry's environmental footprint drastically. Moreover, due to its lower resource usage, it presents opportunities for cost reductions, making it a beneficial solution not only environmentally but also financially. This technique can be scaled up to fit large industrial operations, paving the way for a new, sustainable, and economically viable approach in the textile dyeing industry.",0,2,2,,2,,
32,431,"This solution aims to address the challenge of businesses adopting and implementing circular economy practices. Currently, many businesses are aware of the benefits of the circular economy, but may struggle to find and access reliable suppliers of circular economy solutions. This can result in the use of unsustainable products and services, leading to a continued reliance on linear, take-make-waste production processes. The blockchain-powered platform for circular procurement aims to address this challenge by providing a marketplace for verified and tracked circular economy solutions. The platform would help businesses find and access the circular economy products and services they need, creating a more sustainable and circular economy.","A blockchain-powered platform for circular procurement. The platform would connect businesses with suppliers who offer circular economy solutions, such as recycled materials, closed loop production processes, and circular services. By using blockchain technology, the platform would ensure that the circular economy products and services are verified and tracked, creating a transparent and traceable supply chain. The platform would also provide a marketplace for circular economy solutions, making it easier for businesses to adopt and implement circular economy practices. The blockchain-powered platform for circular procurement would promote a more sustainable and circular economy by creating a transparent and accessible market for circular economy solutions.",0,2,2,,2,,
33,304,"The rapid growth of the digital economy is leading to an increase in energy consumption and carbon emissions, largely due to the operation and manufacturing of data centers. Besides, e-waste from obsolete servers contributes to the growing environmental crisis, making a circular solution essential.  ","Introducing a """"Green Server-as-a-service"""" model could be an excellent circular economy solution. Under this model, tech companies can lease energy-efficient servers to businesses instead of selling them. Once the lease term is over, the servers are returned to the tech company. These returned servers can be refurbished and leased again or responsibly recycled to extract valuable components.   The novelty of this solution is the combination of energy-efficient servers and the leasing model, tackling both CO2 emissions and e-waste. Environmentally, it reduces e-waste volume and the demand for new server manufacturing, consequently lessening resource extraction.  Financially, it lowers the operational costs of data centers due to energy efficiency and provides companies a continuous revenue stream through leasing. It also reduces the financial burden on businesses through the elimination of high upfront costs of server purchase, allowing for predictability of costs through leasing.  The feasibility of implementation is high as it doesn't require considerable alteration in business structures. The scalability is vast due to the universal requirement for data servers across industries. Existing server manufacturing companies can easily switch to this model, making implementation easier and faster. Tying up with recycling firms for material recovery at the end of a server's lifecycle can further optimize the circularity of this system.",0,3,2,,2,,
34,1287,"I would like to address the sustainability of public buildings and their benefit to society and the environment
","Create an ecological public building that will have an intelligent lighting system, hermetic double-glazed openings (DVH), state-of-the-art air conditioning equipment, waste recycling, a water treatment plant, and afforestation with native species. The forecast of a solar energy park that feeds not only the building, but also inputs voltage to the common electrical network, green terraces and ecological gardens that can be worked by low-income people for their sustainability and that of the community.
The idea is that this green support process starts from the State and can then be applied on a smaller scale to social housing and common spaces in society in general.
Each public building will have a differentiated treatment depending on the role it fulfills in society, for example, the Government House must have a sustainable development of more than 70% of its operation, while a Municipal building will lower this percentage considerably to 50%, being these applicable minimum values.",0,2,2,,2,,
35,567,"The global supply chain produces significant waste, partly due to single-use packaging for goods transportation, posing a serious environmental concern. Reducing this packaging waste while improving efficiency and cutting costs can contribute significantly to the circular economy.  ","The proposition is an enhanced version of a """"Packaging as a Service"""" model, which we will call """"Smart, Returnable Packaging as a Service."""" The idea is to create a system where businesses can lease smart, durable, reusable packaging for their supply chain needs.   By embedding each packaging with a unique, digital identity (e.g., RFID tags or IoT sensor), the system can precisely track and manage the use and circulation of the packaging. It'll improve return rates, enhancing visibility for businesses over their supply chain, and increase efficiency.   From an environmental perspective, by significantly reducing the need for single-use packaging, it aids waste reduction and efficiently optimizes transportation routes through sophisticated technology.  For businesses, they'll not only save on constant costs of one-off packaging but also benefit from increased supply chain efficiency and visibility. This could result in additional saving and Implies a positive brand image.  In terms of feasibility and scalability, this solution can be applied across various scales and industries. It's not reliant on consumer behavior changes but instead on businesses' incentive to cut costs and increase efficiency. Despite initial investment requirements, the efficiency gained along with the positive environmental impact make the model attractive for long-term sustainability and profitability. Businesses adopting the model can incrementally scale their investment as they realize its benefits. Regulatory challenges, if any, could be navigated by demonstrating the model's positive environmental and economic impact, aided by potential for sector-wise standardization.",1,2,2,,2,,
36,543,"In the supermarket there is a big basket full of plastic jars of spices,Which it may take a long time to find what the consumer wants","In the supermarket there is a big basket full of plastic jars of spices,Which it may take a long time to find what the consumer wants
These plastic jars of spices, we can replace with smart dispensing machines which have a system that allows customers to refill products . 
Provide the supermarket with a smart dispensing machine, the consumer determines the required quantity, puts the jar and puts the money  like a soft drink machine, or pay by credit card which will be included in machine options , so the consumer will save the packaging price  of the product which approximately 30% of product's price.",0,2,2,,2,,
